<?xml version="1.0" encoding="ISO-8859-1"?>
<!--<!DOCTYPE bib SYSTEM "reglas_biblioteca.dtd">-->
<?xml-stylesheet type="text/xsl" href="biblioteca.xsl" ?>
<bib xmlns:xsi="http://www.w3.org/2001/XMLSchema-instance"
     xsi:noNamespaceSchemaLocation="biblioteca.xsd" nombre="Tomás Carrasquilla" centro="poblado" portada="https://scontent.feoh3-1.fna.fbcdn.net/v/t39.30808-6/301153716_452836323563323_5646586074448291472_n.jpg?_nc_cat=109&amp;ccb=1-7&amp;_nc_sid=e3f864&amp;_nc_ohc=NJclP7e_OQQAX_2m_XS&amp;_nc_ht=scontent.feoh3-1.fna&amp;oh=00_AfDDK2o_SMQOTDtW7eyKc9Q37ymhK47EY01IVu272zTZcg&amp;oe=63697818">
    <libro anyo="1990" cod_pais="ALE">
        <titulo>TCP/IP Illustrated</titulo>
        <autor cedula="NUIP10" foto="https://crearmiempresa.es/wp-content/uploads/2015/07/frases-de-steve-jobs.jpg">
            <apellido>stevens</apellido>
            <nombre>W.</nombre>
        </autor>
        <editorial>Addison-Wesley</editorial>
        <precio>65.95</precio>
    </libro >
    <libro anyo="1992" cod_pais="ESP">
        <titulo>Advanced Programming for Unix environment</titulo>
        <autor cedula="NUIP11">
            <apellido>stevens</apellido>
            <nombre>W.</nombre>
        </autor>
        <editorial>Addison-Wesley</editorial>
        <precio>65.95</precio>
    </libro>
    <libro anyo="2000" cod_pais="ALE">
        <titulo>Data on the Web</titulo>
        <autor cedula="NUIP12">
            <apellido>abiteboul</apellido>
            <nombre>Serge</nombre>
        </autor>
        <autor cedula="NUIP13">
            <apellido>buneman</apellido>
            <nombre>Peter</nombre>
        </autor>
        <autor cedula="NUIP14">
            <apellido>suciu</apellido>
            <nombre>Dan</nombre>
        </autor>
        <editorial>Morgan Kaufmann editorials</editorial>
        <precio>39.95</precio>
    </libro>
    <libro anyo="1999" cod_pais="FRA">
        <titulo> Economics of Technology for Digital TV</titulo>
        <autor cedula="NUIP15">
            <apellido>gerbarg</apellido>
            <nombre>Darcy</nombre>
        </autor>
        <editorial>Kluwer Academic editorials</editorial>
        <precio>129.95</precio>
    </libro>
</bib>
